{
  "$schema": "https://json-schema.org/draft/2020-12/schema",
  "$id": "https://onetool.beycom.online/schemas/console/event-envelope.schema.json",
  "type": "object",
  "required": ["protocol", "protocol_version", "id", "instance_id", "sequence", "type", "created_at", "payload"],
  "properties": {
    "protocol": { "const": "onetool.console" },
    "protocol_version": { "const": 1 },
    "id": { "type": "string", "minLength": 1 },
    "instance_id": { "type": "string", "minLength": 1 },
    "sequence": { "type": "integer", "minimum": 1 },
    "type": { "type": "string", "minLength": 1 },
    "created_at": { "type": "string", "pattern": "^\\d{4}-\\d{2}-\\d{2}T\\d{2}:\\d{2}:\\d{2}" },
    "payload": {}
  },
  "additionalProperties": false
}

